{
  "instances": [
    {
      "attributes": {
        "centerline": [
          [
            10,
            20
          ],
          [
            190,
            20
          ]
        ],
        "orientation_deg": 0.0
      },
      "bbox_xyxy": [
        10,
        10,
        190,
        30
      ],
      "class_name": "wall",
      "id": "gt_wall",
      "mask": {
        "points": [
          [
            10,
            10
          ],
          [
            190,
            10
          ],
          [
            190,
            30
          ],
          [
            10,
            30
          ]
        ],
        "type": "polygon"
      }
    },
    {
      "attributes": {
        "orientation_deg": 0.0
      },
      "bbox_xyxy": [
        70,
        10,
        110,
        30
      ],
      "class_name": "window",
      "id": "gt_window",
      "mask": {
        "points": [
          [
            70,
            10
          ],
          [
            110,
            10
          ],
          [
            110,
            30
          ],
          [
            70,
            30
          ]
        ],
        "type": "polygon"
      }
    },
    {
      "attributes": {
        "orientation_deg": 90
      },
      "bbox_xyxy": [
        135,
        10,
        165,
        45
      ],
      "class_name": "door",
      "id": "gt_door",
      "mask": {
        "points": [
          [
            135,
            10
          ],
          [
            165,
            10
          ],
          [
            165,
            45
          ],
          [
            135,
            45
          ]
        ],
        "type": "polygon"
      }
    },
    {
      "attributes": {
        "orientation_deg": 0.0
      },
      "bbox_xyxy": [
        30,
        70,
        50,
        90
      ],
      "class_name": "column",
      "id": "gt_column",
      "mask": {
        "points": [
          [
            30,
            70
          ],
          [
            50,
            70
          ],
          [
            50,
            90
          ],
          [
            30,
            90
          ]
        ],
        "type": "polygon"
      }
    }
  ],
  "sample_id": "synthetic_residential_001",
  "schema_version": "1.0",
  "verdicts": {
    "column_clearance": "FAIL",
    "door_width": "PASS",
    "window_width": "PASS"
  }
}
